{
  "schema": "quest-termux-lab.fleet-agent-manifest.v1",
  "fleet_id": "synthetic-lab-fleet",
  "agent_id": "quest-agent-alpha",
  "agent_label": "Synthetic Quest Agent Alpha",
  "agent_version": "0.1.0",
  "transport_mode": "outbound_http_poll",
  "central_endpoint": "https://fleet.example.invalid/api/fleet/v1",
  "allowed_command_kinds": [
    "agent.status",
    "agent.capabilities",
    "termux.exec_allowlisted",
    "file.hash",
    "file.list_evidence",
    "adb.self_check"
  ],
  "local_workspace_root": "$HOME/rusty-termux-agent",
  "supports_local_adb": true,
  "public_safe_profile": true,
  "created_at": "2026-06-04T09:00:00Z",
  "updated_at": "2026-06-04T09:00:00Z"
}
